reviewText,summary,sentiment,review_length,VADER_Sentiment,TextBlob_Sentiment
great shoe very comfortable,Five Stars,Positive,4,Positive,Positive
fit comfortable,Five Stars,Positive,2,Positive,Positive
love it super comfortable and nice got more than i expected super flexible great for training definetly recommend it,Love it!! Definetly recommend it,Positive,19,Positive,Positive
in really like these i wear between a 995 womens i got the 95 and they fit perfectly they are light weight but have good support i will buy another pair,Great Shoe,Positive,31,Positive,Positive
picky daughter actually loves them,Worth it.,Positive,5,Positive,Neutral
comfortable,Five Stars,Positive,1,Positive,Positive
love these shoes,Very confortable!,Positive,3,Positive,Positive
just too big otherwise i liked them,Four Stars,Positive,7,Positive,Positive
i wear these everyday to work the gym etc,Five Stars,Positive,9,Neutral,Negative
did not fit well was not comfortable switched to fruit of the loom fruit of the loom are somewhat oversized but fit well and are very comfortable,"Was not comfortable. Switched to ""Fruit of the loom""",Negative,27,Negative,Positive
good light weight shoehad to add insole for more support,Four Stars,Positive,10,Positive,Positive
just what i needed for group fight class quick movements and footwork are so easy in these sneakers love them,Perfect,Positive,20,Positive,Positive
excellent,Five Stars,Positive,1,Positive,Positive
my new gym shoes love them,Love,Positive,6,Positive,Positive
no arch support but l love the colors,Three Stars,Neutral,8,Positive,Positive
straight out of the box these shoes are great very lightweight and fits comfortably on my feet like a glove i love most especially that the sole is not bulky like my previous running shoes  i hated those things lol i would give them a shot and they are great for the price,these shoes are great! Very lightweight and fits comfortably on my feet ...,Positive,53,Positive,Positive
i really love these shoes  they are attractive and very comfortable  they work well for my daily workout and fit well,Attractive and fit well,Positive,21,Positive,Positive
nice product,Four Stars,Positive,2,Positive,Positive
very low cut heel so if you training and pushing sleds  i ran right out of shoes although the traction on toe and heel are great,Low cut heels,Neutral,26,Positive,Positive
i love these shoes  they fit as expected and they look really nice on  these shoes have a narrow base which i really like  i do not like the ones that make your foot look wide,I love these shoes,Positive,36,Positive,Positive
good for nonaerobic workout mesh was very comfortable but no support for lateral movrment,Not for aerobic exercise,Neutral,14,Positive,Positive
tried a lot of shoes for cross training and these were the best,... of shoes for cross training and these were the best!,Positive,13,Positive,Positive
they run big and are super uncomfortable and the soles squeak they do not breathe at all,Two Stars,Negative,17,Positive,Negative
bought these shoes with hiit in mind but not too sure how i like the fit on my foot first time to wear them not great for running maybe after they are broken in a little they will get better if you just need a comfortable pair of shoes for walking they are fine,OK,Neutral,54,Positive,Positive
absolutely love these shoes and color they are perfect for running i run roughly 4 miles 3x per week this is my second or 3rd pair of this exact style fit is perfect,Absolutely love these shoes and color,Positive,33,Positive,Positive
wrong shoes,One Star,Negative,2,Negative,Negative
i really like them,Four Stars,Positive,4,Positive,Positive
love the fit,Five Stars,Positive,3,Positive,Positive
good fit even after washing in hot water to force shrinking i have a 30 inch inseam and 34 waist and got a medium size note that these sweatpants are very thick so not good for warm climates good quality and great price,Good fit,Positive,43,Positive,Positive
look better than the picture very comfortable great support,PERFECT,Positive,9,Positive,Positive
very comfortable,Five Stars,Positive,2,Positive,Positive
in really like these i wear between a 995 womens i got the 95 and they fit perfectly they are light weight but have good support i will buy another pair,Great Shoe,Positive,31,Positive,Positive
these are my favorite walk around shoes i can wear them all day and not be in pain love them,Great for walking!,Positive,20,Positive,Positive
size really depends on the brand  i wear a 65 in nike and they fit me perfectly  these shoes are comfortable they wrap around my feet like a bandage but do not restrict movement,Perfect for the gym,Positive,34,Positive,Positive
love these shoes i have worn them all day and found them really comfortable with no aching feet at the end of the day fantastic colour and true to size i also bought  nike womens flex supreme tr 3 pnk pwmtllc slvrcl grywhite training shoe and these shoes are slightly more comfortable than those even though they look very similar,Love them,Positive,60,Positive,Positive
they are super comfortable loving them,Five Stars,Positive,6,Positive,Positive
perfect fit as always,5 stars,Positive,4,Positive,Positive
perf,So Perf.,Positive,1,Neutral,Neutral
not a fan shoes looked great but too narrow for most feet,Shoes looked great but too narrow for most feet,Neutral,12,Positive,Positive
i liked these shoes a lot very light weight i did not give a 5 because the color was a little lighter than i thought it was going to be but still a great shoe very comfortable,I liked these shoes a lot,Positive,37,Positive,Positive
nice,Three Stars,Neutral,1,Positive,Positive
loved the products and services,Five Stars,Positive,5,Positive,Positive
these shoes fit like a glove light but very supportive i have worn them several times and feel very light on my feet,These shoes fit like a glove,Positive,23,Positive,Positive
super light and very comfortable i am a runner and they lack a bit in arch support so the soles of my feet are a sore i am going to add an insert to try fix the problem,Lack support but overall good shoe,Neutral,38,Positive,Positive
very nice shoe just a bit to snugsmall for my foot the flex wire really makes it the shoe fit tight to your foot i need more wiggle room in my footwear otherwise i would have kept them,Fits snug,Neutral,38,Positive,Positive
perfect,Five Stars,Positive,1,Positive,Positive
put them on and walked 3 hours with no problem love them so light feeling,Love them! So light feeling,Positive,15,Positive,Positive
love them,Five Stars,Positive,2,Positive,Positive
purchased for my daughter for gym class  she loves them  very cute and very comfortable,Great shoes.,Positive,15,Positive,Positive
these are as far as comfort goes the most comfortable pair of sneakers i have i suffer from sciatica pain that goes into my feet i have difficulty finding the proper support and comfort in shoes i would recommend these most definitely,These are as far as comfort goes the most comfortable pair of sneakers I have I suffer from sciatica ...,Positive,42,Positive,Positive
after my purchased i found out they are overpriced they feel good but i will not recommended if you need wide fit,They feel good but I will not recommended if you need Wide ...,Neutral,22,Positive,Positive
i absolutely love these shoes these are my absolute favorite so light and comfortable these are actually my 2nd pair i am still wearing my 1st pair after 2 years and they look good still i am just afraid they are going to disappear and i want a back up pair for when my 1st pair wears out these have been the best shoes i have owned,I absolutely LOVE these shoes,Positive,67,Positive,Positive
i have pretty high arches and my calves always hurt at the gym with other shoes i have been on the hunt for a good cross trainer that i can use to lift take gym classes and lightly jogrun on the treadmill these have been wonderful i do not ever have any pain in my calves or my feet when wearing these and they fit like a glove highly recommend,I have pretty high arches and my calves always hurt at the ...,Positive,70,Positive,Positive
best sneakers i have ever purchased,Five Stars,Positive,6,Positive,Positive
fit like gloves to my feet perfect for workouts,Five Stars,Positive,9,Positive,Positive
they were a gift  to my daughter she loved them,Their Cute and Pink,Positive,10,Positive,Positive
very nice shoes  comfortable,Five Stars,Positive,4,Positive,Positive
so lightweight and awesome,Five Stars,Positive,4,Positive,Positive
very low cut heel so if you training and pushing sleds  i ran right out of shoes although the traction on toe and heel are great,Low cut heels,Neutral,26,Positive,Positive
love these shoes workout in them 34 times a week at the gym i do treadmill stairmaster cardio classes and weight lifting lightweight and versatile shoe,Great shoe for the price!,Positive,26,Positive,Positive
my wife loves these shoes we have both been wearing sketchers and new balance for several years and recently we have both purchased nike there is a reason why nike is still number 1 after all these years you just cannot beat their comfort,My wife loves these shoes. We have both been ...,Positive,44,Positive,Positive
love these shoes i have been buying nikes for years now i bought this pair for work and everyday wear and another pair for working out and active wear they also last a long time in my opinion especially if you take care of them,Classically comfortable and durable,Positive,45,Positive,Positive
i always buy the same size this ones came to large,large shoe,Neutral,11,Neutral,Positive
just do it ,Five Stars,Positive,3,Neutral,Neutral
really comfy and nice color,Great and comfy for sports,Positive,5,Positive,Positive
comfortable,Five Stars,Positive,1,Positive,Positive
wore these for the first time hiking the bluffs not the best traction on well worn rocks but super comfy no blisters no achilles pain like with other shoes will continue to purchase nike shoes because my feet love them for all activities  except my home workouts they drag pretty hard on the carpet,Love,Positive,54,Positive,Positive
super cute shoe however runs wide and big i am a size 10 however this size 10 is too big i went to a sporting goods store and tried the same shoe on  turns out with this particular shoe i am a 95 so order half the size you normally are,Cute,Neutral,51,Positive,Positive
just too big otherwise i liked them,Four Stars,Positive,7,Positive,Positive
great super comfy and cute no issues and fit perfect,perfect,Positive,10,Positive,Positive
i was shocked at how small these shoes were not true at all to size and i own multiple shoes in this brand the quality could have been better in my opinion  very little support from the upper,"Too small, flimsy upper",Neutral,38,Positive,Negative
great product and fast shipping,Five Stars,Positive,5,Positive,Positive
this is a very attractive shoe it is true to size and fits as expected very satisfied with the seller  delivered on time,Very satisfied with the seller - delivered on time,Positive,23,Positive,Positive
love them,Five Stars,Positive,2,Positive,Positive
cute and comfortable,Five Stars,Positive,3,Positive,Positive
bought these as my back up shoes but they have turned into my daily ones i go to so comfortable and my feet do not hurt after long hours on my feet i own a cleaning business so i need my feet not to hurt in the middle of the day,Honestly Fantastic Shoes,Positive,51,Positive,Positive
love the color and fit i use them to work on at the gym on the treadmill and they are very light and comfortable,Love the color and fit,Positive,24,Positive,Positive
on time nice sneakers fit as expected,nice sneakers. Fit as expected,Positive,7,Positive,Positive
just do it ,Five Stars,Positive,3,Neutral,Neutral
these shoes look really great however slightly loose the problems with lack of support arose when i exercised it feels like there is little to no support in them possibly this is a shoe more geared for an office environment or short walking distances,Unnacceptable. Zero support,Neutral,44,Positive,Positive
"they are fine for the value particularly since i lose so many
reading glasses  some of the screws do require constant
tightening",loose screws,Neutral,22,Negative,Positive
not a lot of arch support but really lightweight,Four Stars,Positive,9,Positive,Positive
super comfy,Five Stars,Positive,2,Positive,Positive
very comfy if they had pockets they would be awesome i bought these for me to lounge around in and my husband has stolen them i might have to buy another pair,Comfy and warm.,Positive,32,Positive,Positive
fit well,Five Stars,Positive,2,Positive,Positive
love this product  great fit,Five Stars,Positive,5,Positive,Positive
the shoes fit perfectly and came within the time frame i was given  very comfortable which is needed since my job requires a lot if standing abd walking throughout the day,Great shoe!,Positive,31,Positive,Positive
great product and fast shipping,Five Stars,Positive,5,Positive,Positive
size colour and print all above average but does not wash great,Cold wash or you'll be handing this down,Positive,12,Negative,Positive
great arch support and cushion both for the heel and ball of the foot great aerobic shoe,Nice Support,Positive,17,Positive,Positive
i bought these sneakers for boot camp class  they are very light weight and different than other sneakers that i have owned  have only used them a few times but like them so far,but like them so far,Positive,34,Positive,Positive
excelente,Five Stars,Positive,1,Neutral,Neutral
daughter loves them,Five Stars,Positive,3,Positive,Neutral
i have been wearing for a solid week during my work outs  they are great for comfort and they are light weight,Love these shoes,Positive,22,Positive,Positive
favorite nikes ever i already owned this style and was ready for a new pair so i went with these love the color and they fit great,Favorite Nikes ever,Positive,27,Positive,Positive
this pair fits perfectthe first pair was wrong size in the right boxdefinitely order again,Five Stars,Positive,15,Negative,Positive
love these shoes workout in them 34 times a week at the gym i do treadmill stairmaster cardio classes and weight lifting lightweight and versatile shoe,Great shoe for the price!,Positive,26,Positive,Positive
i feel like this pair of shoes was made for my feet great fit and comfort very pleased with this purchase,I feel like this pair of shoes was made for my feet,Positive,21,Positive,Positive
"for the price i spent on the pair of shoes id say its as good as expected
its comfortable and does not hurt my feet when i run",Pretty comfortable pair of running shoes,Positive,28,Positive,Positive
wow these are the most comfortable light weight shoes i love them,so light & comfortable!,Positive,12,Positive,Positive
loved the products and services,Five Stars,Positive,5,Positive,Positive
nice,Three Stars,Neutral,1,Positive,Positive
the shoes are amazingvery comfortable and fit as expected highly recommended ,Amazing,Positive,11,Positive,Positive
super comfortable and extremely lightweight great for crossfit,Five Stars,Positive,8,Positive,Positive
they were a gift  to my daughter she loved them,Their Cute and Pink,Positive,10,Positive,Positive
they are ugly the toe is rounded and the material is weird the nike womens flex trainer 6 is way better looking and costs about the same,the Nike Womens Flex Trainer 6 is way better looking and costs about the same,Neutral,27,Negative,Negative
excellent,Five Stars,Positive,1,Positive,Positive
i love these shoes my second pair of 40 plus  shoes and they both have certainly out done the 100 kswiss that i am looking to return  the shoes are extremely comfortable all my clients love them just wish they came in more colors,I love these shoes my second pair of 40 plus $ ...,Positive,44,Positive,Positive
i bought these for my wife she saw them in the store but did not have their size so i ordered on amazon she loves them  she already had for a couple of months and no complains at all one of her favorites shoes for running or for her job since she walks a lot in the warehouse now she loves me more ,My wife loves these shoes.,Positive,63,Positive,Positive
i love this show,So happy.,Positive,4,Positive,Positive
they run big order a full size smaller,Four Stars,Positive,8,Neutral,Positive
my favorite cross trainers,Comfortable,Positive,4,Positive,Positive
my favorite nike shoe,Five Stars,Positive,4,Positive,Positive
loved the products and services,Five Stars,Positive,5,Positive,Positive
i love this shoes they are so comfortable,Five Stars,Positive,8,Positive,Positive
they are very comfortable feel like you have nothing on,Five Stars,Positive,10,Positive,Positive
bought these shoes with hiit in mind but not too sure how i like the fit on my foot first time to wear them not great for running maybe after they are broken in a little they will get better if you just need a comfortable pair of shoes for walking they are fine,OK,Neutral,54,Positive,Positive
i returned these as they were not true to size they ran large,Not true to size,Negative,13,Negative,Positive
i love this show,So happy.,Positive,4,Positive,Positive
sizing was perfect as ordered quality appears good still new not too much more to report,Correct size,Positive,16,Positive,Positive
no pockets and huge the bottom of the pants go over shoes,large with no pockets,Neutral,12,Positive,Positive
i have not even had them a month and the bottom is coming off i am not happy,Falling apart already!!,Negative,18,Negative,Negative
perfect,Five Stars,Positive,1,Positive,Positive
super comfortable and extremely lightweight great for crossfit,Five Stars,Positive,8,Positive,Positive
very nice shoe just a bit to snugsmall for my foot the flex wire really makes it the shoe fit tight to your foot i need more wiggle room in my footwear otherwise i would have kept them,Fits snug,Neutral,38,Positive,Positive
very comfortable and looks great,Five Stars,Positive,5,Positive,Positive
i loved these shoes when i got them i have noticed that the foam inside tends to compress during a workout though ill lace them tightly enough that they are nearly cutting off my circulation 20 minutes later i am sliding out of them while doing sled pushes,Foam compresses,Negative,48,Positive,Negative
great price for the product though the sizes tend to be bigger based on mens size i think  there was not a size chart to refer to when i was ordering so i ended up buying two each at a difference size,size runs big,Positive,42,Positive,Positive
excellent,Five Stars,Positive,1,Positive,Positive
good quality perfect fit  its a nike,Good Sneaker,Positive,7,Positive,Positive
second pair comfortable and great for people with bunion issues or previous surgeries  sole wears great,staple sneakers,Positive,16,Positive,Positive
nice looking and fit nice,Four Stars,Positive,5,Positive,Positive
nice looking and fit nice,Four Stars,Positive,5,Positive,Positive
average product  as described,Three Stars,Neutral,4,Neutral,Negative
my daughter loves them great fit,Great fit!,Positive,6,Positive,Positive
ugh way to large  is this for a man,Nope,Neutral,9,Negative,Positive
i bought a pair of these in my size but they are too small i can get my feet in them but not comfortably its too bad because i can tell the soles are comfortable of course now i have work them to work so i cannot return them,Get a half-size or more larger than usual.,Neutral,49,Negative,Negative
extremely well fitting and light weight,Five Stars,Positive,6,Positive,Positive
love these shoes i have worn them all day and found them really comfortable with no aching feet at the end of the day fantastic colour and true to size i also bought  nike womens flex supreme tr 3 pnk pwmtllc slvrcl grywhite training shoe and these shoes are slightly more comfortable than those even though they look very similar,Love them,Positive,60,Positive,Positive
size really depends on the brand  i wear a 65 in nike and they fit me perfectly  these shoes are comfortable they wrap around my feet like a bandage but do not restrict movement,Perfect for the gym,Positive,34,Positive,Positive
excellent ,Five Stars,Positive,1,Positive,Positive
cute shoe fit as expected and very comfortable,and very comfortable.,Positive,8,Positive,Positive
right one is slightly tight hope it will stretch out ,Four Stars,Positive,10,Positive,Positive
good product for the price  used very day and no problem,Five Stars,Positive,11,Negative,Positive
"love these shoes
so stylish and comfortable just got back from a trip to nyc black and white nikes and yoga pants are in high fashion right now",Love these shoes,Positive,28,Positive,Positive
love love love,Five Stars,Positive,3,Positive,Positive
love them fit exactly as expected in length and width i would definitely buy these again,Five Stars,Positive,16,Positive,Positive
super comfy,Five Stars,Positive,2,Positive,Positive
quick tranasaction  loved the shoes  would purchase from them again,Awesome shoes!!!,Positive,10,Positive,Positive
love them  very comfortable and great for weight training,Love them! Very comfortable and great for weight training,Positive,9,Positive,Positive
excellent ,Five Stars,Positive,1,Positive,Positive
wrong shoes,One Star,Negative,2,Negative,Negative
good fit and comfy  not so cushiony so definetly better for training and not for running or aerobics bought size 8 which is my usual size,Good choice for training shoe,Positive,26,Positive,Positive
they looked very cheap,Returned...looked cheap,Negative,4,Neutral,Positive
they fit perfectly these shoes are great for walking  so very comfortable love them,These shoes are great for walking - so very comfortable,Positive,14,Positive,Positive
they fit perfect extremely comfortable,Five Stars,Positive,5,Positive,Positive
great shoes,Five Stars,Positive,2,Positive,Positive
love this shoes so comfy and great very everyday use runs big,Fits wonderful,Positive,12,Positive,Positive
love these comfy shoes they fit like a glove,Five Stars,Positive,9,Positive,Positive
nice looking and fit nice,Four Stars,Positive,5,Positive,Positive
light weight and comfortable,Four Stars,Positive,4,Positive,Positive
my favorite nike shoe,Five Stars,Positive,4,Positive,Positive
i loved these shoes when i got them i have noticed that the foam inside tends to compress during a workout though ill lace them tightly enough that they are nearly cutting off my circulation 20 minutes later i am sliding out of them while doing sled pushes,Foam compresses,Negative,48,Positive,Negative
lightweight decent arch support and comfortably to wear all day doing regular activity and sprinting,decent arch support and comfortably to wear all day doing regular activity and sprinting,Positive,15,Positive,Positive
love them,Five Stars,Positive,2,Positive,Positive
wrong shoes,One Star,Negative,2,Negative,Negative
nice shoes fit good,Five Stars,Positive,4,Positive,Positive
very comfortable shoes this is my second pair of this style of shoe because i loved them that much,Very comfortable shoes. This is my second pair of this ...,Positive,19,Positive,Positive
love it super comfortable and nice got more than i expected super flexible great for training definetly recommend it,Love it!! Definetly recommend it,Positive,19,Positive,Positive
fits good very lightweight,Four Stars,Positive,4,Positive,Positive
after my purchased i found out they are overpriced they feel good but i will not recommended if you need wide fit,They feel good but I will not recommended if you need Wide ...,Neutral,22,Positive,Positive
fits perfect,Five Stars,Positive,2,Positive,Positive
love these sneakers light weight and comfortable even without socks,"Comfortable, light weight, nice.",Positive,10,Positive,Positive
beautiful i love them comfy,Five Stars,Positive,5,Positive,Positive
great shoes lightweight and comfortable,Five Stars,Positive,5,Positive,Positive
great arch support and cushion both for the heel and ball of the foot great aerobic shoe,Nice Support,Positive,17,Positive,Positive
love them,Five Stars,Positive,2,Positive,Positive
great shoe very comfortable,Five Stars,Positive,4,Positive,Positive
normally nike fits small so we go up a half size these actually fit to my wifes appropriate size so be ware when you order,Fit to actual size.,Positive,25,Positive,Positive
love these shoes they are true to size and very comfortable this is my second pair  i wore out the first pair good arch support  i have a high arch,Love these shoes,Positive,30,Positive,Positive
i love the shoe and it fit as expected the photos and description are accurate if you are looking for a shoe that has more cushion or support try a different style but as far as wanting a lightweight and breathable shoe this is it i am very satisfied with this purchase,I love the shoes and the description and photos were accurate,Positive,52,Positive,Positive
i love these shoes  they fit as expected and they look really nice on  these shoes have a narrow base which i really like  i do not like the ones that make your foot look wide,I love these shoes,Positive,36,Positive,Positive
arrived on time i probably should have gone with a 75 instead of an 8 because they do seem a little big but if i wear thick socks they are fine also they can sometimes make a very annoying squeaky noise when i run on certain surfaces so i am trying to get them worn in overall i am satisfied with my purchase,but if I wear thick socks they are fine. Also,Positive,63,Positive,Negative
comfortable shoe  first time i have ever bought nikes that feel so large  it feels about 12 size too big  i bought 75  i normally wear exactly that size and on occasion an 8,Runs large,Negative,34,Positive,Positive
they fit perfect extremely comfortable,Five Stars,Positive,5,Positive,Positive
