reviewText,summary,sentiment,review_length,VADER_Sentiment,TextBlob_Sentiment
"the best sneakers by far i had never owned a pair of nike sneakers and i went solely on the reviews by others
and i absolutely loved them",the best sneakers by far,Positive,28,Positive,Positive
great shoes fit perfectly comfortable right from the start light weight and perfect for a 12 hour work shift good price also,Great shoes. Fit perfectly,Positive,22,Positive,Positive
comfortable and lightweight,Five Stars,Positive,3,Positive,Positive
these are the best shoes i have ever use for my workouts i love them and buy them in bulk lol,These are the best shoes I have ever use for my workouts,Positive,21,Positive,Positive
the sneakers are very comfortable and fit to size,Five Stars,Positive,9,Positive,Positive
love these shoes they are so comfortable,Five Stars,Positive,7,Positive,Positive
excellent value,excellent value and quality,Positive,2,Positive,Positive
size 5 very comfortable shoes love,Very comfortable shoes. Love,Positive,6,Positive,Positive
these are as far as comfort goes the most comfortable pair of sneakers i have i suffer from sciatica pain that goes into my feet i have difficulty finding the proper support and comfort in shoes i would recommend these most definitely,These are as far as comfort goes the most comfortable pair of sneakers I have I suffer from sciatica ...,Positive,42,Positive,Positive
love this product  great fit,Five Stars,Positive,5,Positive,Positive
great arch support and comfortable,Great cross trainer,Positive,5,Positive,Positive
comfortable,Five Stars,Positive,1,Positive,Positive
wore these for the first time hiking the bluffs not the best traction on well worn rocks but super comfy no blisters no achilles pain like with other shoes will continue to purchase nike shoes because my feet love them for all activities  except my home workouts they drag pretty hard on the carpet,Love,Positive,54,Positive,Positive
the shoes are amazingvery comfortable and fit as expected highly recommended ,Amazing,Positive,11,Positive,Positive
great shoes,Five Stars,Positive,2,Positive,Positive
the material is real then hope they do not fall apart  to expensive for what you get,Three Stars,Neutral,17,Positive,Negative
these shoes are awesome  they are nearly weightless and feel great on my feet  the first day i wore them i wore them all day on vacation  i put them on the next day and did the same  besides the comfort they are really a cool color,Awesome shoes!,Positive,47,Positive,Positive
fits good very lightweight,Four Stars,Positive,4,Positive,Positive
serves intended purpose,Good shoe,Positive,3,Neutral,Neutral
great look but zero support inside the shoe had to buy expensive inserts to be wearable expected more from a nike shoe,"Style 10/10, Comfort 3/10",Neutral,22,Positive,Positive
love these shoes they are so comfortable,Five Stars,Positive,7,Positive,Positive
absolutely love these shoes and color they are perfect for running i run roughly 4 miles 3x per week this is my second or 3rd pair of this exact style fit is perfect,Absolutely love these shoes and color,Positive,33,Positive,Positive
favorite nike shoe ever the flex sole is excellent for someone like me who loves the free feeling of sandals or being barefoot these move effortlessly with the bend of my foot i have worn these for multiple activities and i have had no foot or ankle pain the whitegreendark grey color goes with so many outfits and the mesh breathes perfectly on hot summer days highly recommend,Love them!,Positive,68,Positive,Positive
loved the products and services,Five Stars,Positive,5,Positive,Positive
these shoes are extremely comfortable and fit as expected  will purchase again,Five Stars,Positive,12,Positive,Positive
love my new nikes  its been years since i have been able to wear them sizing changed years ago and i just could not wear them any more but now the new styles and sizing are perfect  lightweight shoe with tons of style  the fog color is just what i was looking fornot black and not neon  i wore them to participate in relay for life 24 hour walk and they held up great,Nice shoe,Positive,74,Positive,Positive
the shoes are true to size i am used to wearing running shoes so these have been an adjustment overall the shoe is nice and provides well for my hiit and grit classes i take,the shoe is nice and provides well for my HIIT and Grit classes ...,Positive,35,Positive,Positive
they are very comfortable feel like you have nothing on,Five Stars,Positive,10,Positive,Positive
exactly what i expected comfortable and chic,Comfortable and,Positive,7,Positive,Positive
they run big order a full size smaller,Four Stars,Positive,8,Neutral,Positive
love these comfortable light weight great fit,Sooo comfortable,Positive,7,Positive,Positive
cute and comfortable,Five Stars,Positive,3,Positive,Positive
love these shoes,Very confortable!,Positive,3,Positive,Positive
nice,Five Stars,Positive,1,Positive,Positive
great look but zero support inside the shoe had to buy expensive inserts to be wearable expected more from a nike shoe,"Style 10/10, Comfort 3/10",Neutral,22,Positive,Positive
obsessed with these shoes i was looking for good all around sneakers running walking tennis etc and these more than fit the bill i was looking specifically for black nikes i love the fit with white soles good for court sports i was a little reluctant to purchase because i was not sure whether the black on the soles would contact the ground but it does not,Very Happy Customer,Positive,67,Positive,Positive
it is so handy to have this many reading glasses at such a reasonable price  i like this style reading glasses instead of the ones with nose pieces i find this style more comfortable  these glasses are very nicecheaper than walmart,Good Value,Positive,41,Positive,Positive
i love my tennis shoes,Five Stars,Positive,5,Positive,Positive
very comfortable,Five Stars,Positive,2,Positive,Positive
i loved these shoesthat is until after about an hour of wear the green inserts on the sole of the right show began falling off the wear was in my home on smooth floors i can only assume they were defective,I loved these shoes,Negative,41,Positive,Positive
super comfortable and fit my small feet perfectly i have flat feet so a lot of shoes are not comfortable for long periods of time i can wear the shoe all day long and they are super comfortable they are light colored so any dirt will be seen right away but they are easy to clean compared to other shoes i have had would definitely buy another pair in a different color,LOVE my new sneakers!,Positive,72,Positive,Positive
very nice high quality,Five Stars,Positive,4,Positive,Positive
excellent,Five Stars,Positive,1,Positive,Positive
they fit perfect extremely comfortable,Five Stars,Positive,5,Positive,Positive
excelente,Five Stars,Positive,1,Neutral,Neutral
best tennis shoes i have had all my life very comfortable out the box i would buy 10 pairs of these shoes if had the money,Very Comfortable,Positive,26,Positive,Positive
great shoe very comfortable,Five Stars,Positive,4,Positive,Positive
great shoes  was looking for something to replace my barefeet so i can wear orthotics while kickboxing these are light weight hug my feet comfortably and have a thinner upper so i can still feel the bag when i kick and they have good lateral stability my feet are on the narrow side so its hard to find shoes that are snug enough these are perfect oh and they are really cute too,Great for kickboxing,Positive,73,Positive,Positive
my favorite running shoes  the wall of the shoe is very thin which makes them very comfortable to wear if your feet swell as you run  i would not recommend for use on concrete or a treadmill as there is not very much impact absorption but they are perfect for trail running,Perfect for trails,Positive,52,Positive,Positive
very lightweight normal nike quality pink is very bright  colors look great together,colors look great together.,Positive,13,Positive,Positive
these shoes look really great however slightly loose the problems with lack of support arose when i exercised it feels like there is little to no support in them possibly this is a shoe more geared for an office environment or short walking distances,Unnacceptable. Zero support,Neutral,44,Positive,Positive
i usually wear a size 8 and they fit fine these are way too narrow thought they might stretch out but they did not had to give away,TOO NARROW!,Negative,28,Positive,Positive
ok but too big,Three Stars,Neutral,4,Positive,Positive
fit like a dream great for crosstraininghitt videos i do everyday great for walking too look amazing,Great sneakers!,Positive,17,Positive,Positive
these run large i wear a 95 exactly in every shoe but these i bought a 9 and the toe area is pretty wide plus plenty long even with socks very comfy and very nice looking shoe i love them but glad i was able to try them on before purchasing,and the toe area is pretty wide plus plenty long even with socks,Positive,51,Positive,Positive
love the lightweight and the fit,Five Stars,Positive,6,Positive,Positive
my daughter loves these shoes fit true to size,Great looking shoe,Positive,9,Positive,Positive
super light and very comfortable i am a runner and they lack a bit in arch support so the soles of my feet are a sore i am going to add an insert to try fix the problem,Lack support but overall good shoe,Neutral,38,Positive,Positive
nice product,Four Stars,Positive,2,Positive,Positive
c,Five Stars,Positive,1,Neutral,Neutral
ordered half a size larger than my usual shoe size and fits perfectly,Nike runs small,Positive,13,Positive,Positive
havaianas are the best,Five Stars,Positive,4,Positive,Positive
serves intended purpose,Good shoe,Positive,3,Neutral,Neutral
right one is slightly tight hope it will stretch out ,Four Stars,Positive,10,Positive,Positive
great shoes,Five Stars,Positive,2,Positive,Positive
fit perfectly i bought dark grey and they did not fade,Five Stars,Positive,11,Positive,Positive
fits perfect,Five Stars,Positive,2,Positive,Positive
very comfortable,Five Stars,Positive,2,Positive,Positive
i have gotten so many compliments on the blue color and look of this shoe  it is super comfortable  the grip is wonderful for my indoor gym cross training classes  i always order a half size larger in nike brand shoes and thy fit perfectly as i did with this shoe,Love These Shoes!,Positive,51,Positive,Positive
"the waist string broke first time trying them on luckily i do not really need the wast string but it would be nice if it did not break

that being said the pants fit as expected and are comfortable probably shop around next time i make a sweatpant purchase",Don't sweat the pants,Neutral,49,Positive,Positive
nice shoes fit good,Five Stars,Positive,4,Positive,Positive
love these comfortable light weight great fit,Sooo comfortable,Positive,7,Positive,Positive
just what i needed for group fight class quick movements and footwork are so easy in these sneakers love them,Perfect,Positive,20,Positive,Positive
the shoes fit perfectly and came within the time frame i was given  very comfortable which is needed since my job requires a lot if standing abd walking throughout the day,Great shoe!,Positive,31,Positive,Positive
i love these and have them in a light blue too very light weight airy and comfortable,Five Stars,Positive,17,Positive,Positive
good fit and comfy  not so cushiony so definetly better for training and not for running or aerobics bought size 8 which is my usual size,Good choice for training shoe,Positive,26,Positive,Positive
i returned themfound a ryka pair i liked better,found a Ryka pair I liked,Neutral,9,Positive,Positive
these shoes are great  this is the second pair that i have purchased and i love them,Really Comfortable Shoes,Positive,17,Positive,Positive
nike always makes a good shoe abit rough breaking them in but after 9 hours on my feet anyones feet would hurt abit,Nike always makes a good shoe.,Positive,23,Negative,Positive
"the waist string broke first time trying them on luckily i do not really need the wast string but it would be nice if it did not break

that being said the pants fit as expected and are comfortable probably shop around next time i make a sweatpant purchase",Don't sweat the pants,Neutral,49,Positive,Positive
super comfortable i joined cross fit and this is the perfect shoe,Super comfortable. I joined Cross Fit and this is ...,Positive,12,Positive,Positive
these shoes fit like a glove light but very supportive i have worn them several times and feel very light on my feet,These shoes fit like a glove,Positive,23,Positive,Positive
perfect for the gym could use a little more support in the toe area but very comfortable and light fit true to size,Perfect for the gym,Positive,23,Positive,Positive
"unfortunately this flex supreme does not have enough support over the toe and ankle are for my requirements
returning for credit  thanks anyway",Did not fit my feet,Negative,23,Positive,Negative
i love these shoes my second pair of 40 plus  shoes and they both have certainly out done the 100 kswiss that i am looking to return  the shoes are extremely comfortable all my clients love them just wish they came in more colors,I love these shoes my second pair of 40 plus $ ...,Positive,44,Positive,Positive
"unfortunately this flex supreme does not have enough support over the toe and ankle are for my requirements
returning for credit  thanks anyway",Did not fit my feet,Negative,23,Positive,Negative
i love these shoes i exercise in them as well as just take them on longer walks feels good looks great,I love these shoes,Positive,21,Positive,Positive
super comfortable i joined cross fit and this is the perfect shoe,Super comfortable. I joined Cross Fit and this is ...,Positive,12,Positive,Positive
my son likes these and this is the 2nd pair hes worn,"Good shoes, tolerable price.",Positive,12,Positive,Neutral
love these shoes i have been buying nikes for years now i bought this pair for work and everyday wear and another pair for working out and active wear they also last a long time in my opinion especially if you take care of them,Classically comfortable and durable,Positive,45,Positive,Positive
these shoes fit like a glove light but very supportive i have worn them several times and feel very light on my feet,These shoes fit like a glove,Positive,23,Positive,Positive
they run big and are super uncomfortable and the soles squeak they do not breathe at all,Two Stars,Negative,17,Positive,Negative
most comfortable training shoes i have worn in a long time,Lightweight yet supportive,Positive,11,Positive,Positive
love great price too,Exactly what I wanted,Positive,4,Positive,Positive
they looked very cheap,Returned...looked cheap,Negative,4,Neutral,Positive
perfect fit brand new in new box completely perfect condition and on sale awesome highly reccomend super cute shoes,Super cute and on sale!!,Positive,19,Positive,Positive
my favorite cross trainers,Comfortable,Positive,4,Positive,Positive
lightweight comfortable supportive very happy i bought these shoes for working out,Great training shoes,Positive,12,Positive,Positive
i love these shoes i exercise in them as well as just take them on longer walks feels good looks great,I love these shoes,Positive,21,Positive,Positive
very comfortable sneakers and i also like the way it fits,Four Stars,Positive,11,Positive,Positive
great shoe outside arch is kind of high but i am still breaking them in so i am sure that will work its way out i originally ordered a 9 my regular size and it was a tad too big returned and ordered an 85 and it fits perfect,Consider sizing down 1 size,Positive,49,Positive,Positive
straight out of the box these shoes are great very lightweight and fits comfortably on my feet like a glove i love most especially that the sole is not bulky like my previous running shoes  i hated those things lol i would give them a shot and they are great for the price,these shoes are great! Very lightweight and fits comfortably on my feet ...,Positive,53,Positive,Positive
serves intended purpose,Good shoe,Positive,3,Neutral,Neutral
right one is slightly tight hope it will stretch out ,Four Stars,Positive,10,Positive,Positive
took other reviewers advice and went up half size and it was too large i thought this was a more socklike fit but it had a tongue that came up high on my ankle not at all sock like nice looking and very light weight with a rounded square toe that left plenty of room front foot and toes these just were not what i was looking for,Not as expected,Neutral,68,Positive,Positive
ugh way to large  is this for a man,Nope,Neutral,9,Negative,Positive
i love the shoe and it fit as expected the photos and description are accurate if you are looking for a shoe that has more cushion or support try a different style but as far as wanting a lightweight and breathable shoe this is it i am very satisfied with this purchase,I love the shoes and the description and photos were accurate,Positive,52,Positive,Positive
love them  very comfortable and great for weight training,Love them! Very comfortable and great for weight training,Positive,9,Positive,Positive
love them  i ordered an 85 because i usually wear that size but these are a bit big i wish i ordered an 8 they are really comfortable and i enjoy wearing them,"Look amazing, runs slightly big.",Positive,33,Positive,Positive
gracias,Five Stars,Positive,1,Neutral,Neutral
the fit is as expected,Fits to size,Positive,5,Positive,Positive
i have been using these to exercise and they are nice a roomy and allow my feet to breath also love the colors,I've been using these to exercise and they are nice a roomy and allow my feet to breath,Positive,23,Positive,Positive
wore these for the first time hiking the bluffs not the best traction on well worn rocks but super comfy no blisters no achilles pain like with other shoes will continue to purchase nike shoes because my feet love them for all activities  except my home workouts they drag pretty hard on the carpet,Love,Positive,54,Positive,Positive
finally after trying about 10 pairs of nikes these were a perfect fit  they are light and very comfortable i really just forget about my feet when i am wearing them,these were a perfect fit. They are light and very comfortable,Positive,31,Positive,Positive
tried them on in a store before buying online so i knew they would fit good overall i was looking for a durable cross training shoe that would hold up to my rigorous training and these have been great so far they are really light and comfortable most importantly for me they have grips on the bottoms so my feet do not slide out from under me while doing planks pushups etc highly satisfied with this purchase,Exactly What I Was Looking For,Positive,77,Positive,Positive
good light weight shoehad to add insole for more support,Four Stars,Positive,10,Positive,Positive
my favorite running shoes  the wall of the shoe is very thin which makes them very comfortable to wear if your feet swell as you run  i would not recommend for use on concrete or a treadmill as there is not very much impact absorption but they are perfect for trail running,Perfect for trails,Positive,52,Positive,Positive
arrived on time i probably should have gone with a 75 instead of an 8 because they do seem a little big but if i wear thick socks they are fine also they can sometimes make a very annoying squeaky noise when i run on certain surfaces so i am trying to get them worn in overall i am satisfied with my purchase,but if I wear thick socks they are fine. Also,Positive,63,Positive,Negative
i am so happy with this purchase i feel like i am barely wearing a sneaker when working out another plus is that when i take off my sneaker my sock is barely sweaty i have never had that experience with a shoe the shoe is also very attractive and flattering and looks nice on my feet,I am so happy with this purchase,Positive,57,Positive,Positive
she loves them,Five Stars,Positive,3,Positive,Neutral
i bought a pair of these in my size but they are too small i can get my feet in them but not comfortably its too bad because i can tell the soles are comfortable of course now i have work them to work so i cannot return them,Get a half-size or more larger than usual.,Neutral,49,Negative,Negative
so comfortable i do not even feel like i have a sneaker on based on the other reviews i got a half a size up and glad i did,"So comfortable, I don't even feel like I have a ...",Positive,29,Positive,Positive
i was shocked at how small these shoes were not true at all to size and i own multiple shoes in this brand the quality could have been better in my opinion  very little support from the upper,"Too small, flimsy upper",Neutral,38,Positive,Negative
fits good very lightweight,Four Stars,Positive,4,Positive,Positive
super comfy true size  i use them for boot camp  cross fit and they are great  absolutely recommended it,Great training shoes,Positive,19,Positive,Positive
nice shoes,Five Stars,Positive,2,Positive,Positive
they are very comfortable feel like you have nothing on,Five Stars,Positive,10,Positive,Positive
i have had these shoes for about a week now and have so far enjoyed using them considering the fact that i have wide feet the shoes are slightly tight however it does not feel uncomfortable nor does it bothers me as i use them throughout my workouts i know some people personally like when the shoes are a bit tighter or a bit looser so its all in personal preference,Wide Feet so Somewhat Tight,Positive,71,Positive,Negative
this is a shoe i will wear with black dress pants or jeans when i need comfort and a little style but i am not impressed  this is a very flimsy shoe with little support at all  not like any nike i have ever purchased in the past  it looks nice but its not comfortable,"LOOKS GOOD, FEELS ICKY!",Neutral,55,Negative,Negative
i always order a 12 size up in workout shoes,Lightweight,Positive,10,Neutral,Neutral
fit true to size,Five Stars,Positive,4,Positive,Positive
love these shoes i have been buying nikes for years now i bought this pair for work and everyday wear and another pair for working out and active wear they also last a long time in my opinion especially if you take care of them,Classically comfortable and durable,Positive,45,Positive,Positive
they run big and are super uncomfortable and the soles squeak they do not breathe at all,Two Stars,Negative,17,Positive,Negative
fits perfect my daughter loves them,Five Stars,Positive,6,Positive,Positive
love them  very comfortable and great for weight training,Love them! Very comfortable and great for weight training,Positive,9,Positive,Positive
absolutely love these shoes and color they are perfect for running i run roughly 4 miles 3x per week this is my second or 3rd pair of this exact style fit is perfect,Absolutely love these shoes and color,Positive,33,Positive,Positive
great shoes lightweight and comfortable,Five Stars,Positive,5,Positive,Positive
absolutly love these shoes beautiful color comfy and lightweight,New Favorite Shoes,Positive,9,Positive,Positive
i used this for a costume and it worked well,Nice fit,Positive,10,Positive,Neutral
this is a great shoe for in gym workouts i did take a 10 mile hike and had a blister on my pinky but other than that these are very comfortable shoes,"True to size, would recommend",Positive,32,Positive,Positive
i love these shoes,Five Stars,Positive,4,Positive,Positive
fit comfortable,Five Stars,Positive,2,Positive,Positive
i love this show,So happy.,Positive,4,Positive,Positive
they fit perfectly these shoes are great for walking  so very comfortable love them,These shoes are great for walking - so very comfortable,Positive,14,Positive,Positive
loved the products and services,Five Stars,Positive,5,Positive,Positive
i have had these shoes for about a week now and have so far enjoyed using them considering the fact that i have wide feet the shoes are slightly tight however it does not feel uncomfortable nor does it bothers me as i use them throughout my workouts i know some people personally like when the shoes are a bit tighter or a bit looser so its all in personal preference,Wide Feet so Somewhat Tight,Positive,71,Positive,Negative
perfect fit very comfortable and a great color they also fit as expected,Five Stars,Positive,13,Positive,Positive
got them for my girlfriend she loves them says its like wearing slippers because they are incredibly light,Great shoes,Positive,18,Positive,Positive
love love love,Five Stars,Positive,3,Positive,Positive
these were exactly what i expected,Five Stars,Positive,6,Neutral,Positive
the shoes are true to size i am used to wearing running shoes so these have been an adjustment overall the shoe is nice and provides well for my hiit and grit classes i take,the shoe is nice and provides well for my HIIT and Grit classes ...,Positive,35,Positive,Positive
i had the older generation of this shoe that survived 2 or 3 mud runs and of all my aches and pains my feet was not one of them this is because of this shoe nike really dropped the mic with this,I had the older generation of this shoe that survived ...,Positive,42,Negative,Positive
favorite nikes ever i already owned this style and was ready for a new pair so i went with these love the color and they fit great,Favorite Nikes ever,Positive,27,Positive,Positive
excellent ,Five Stars,Positive,1,Positive,Positive
very comfortable shoes this is my second pair of this style of shoe because i loved them that much,Very comfortable shoes. This is my second pair of this ...,Positive,19,Positive,Positive
perf,So Perf.,Positive,1,Neutral,Neutral
great arch support and cushion both for the heel and ball of the foot great aerobic shoe,Nice Support,Positive,17,Positive,Positive
love these shoes needed new running shoes and these are perfect light weight and fit great,Five Stars,Positive,16,Positive,Positive
love these shoes for circuit training,Five Stars,Positive,6,Positive,Positive
